# ----------------------------------------,,,,,,,,
# 1 Master View,,,,,,,,
# Rendimiento del producto,,,,,,,,
# 20190101-20191231,,,,,,,,
# ----------------------------------------,,,,,,,,
,,,,,,,,
Producto,Ingresos del producto,Compras únicas,Cantidad,Precio medio,Cantidad media,Importe de reembolso del producto,Porcentaje carrito/detalle,Porcentaje compra/detalle
Google Utility BackPack,"2.039,87 US$",14,17,"119,99 US$","1,21","0,00 US$","4,22 %","0,08 %"
Google Zip Hoodie F/C,"1.979,83 US$",33,33,"59,99 US$","1,00","0,00 US$","17,68 %","0,47 %"
Google Color Block Notebook,"1.920,99 US$",11,160,"12,01 US$","14,55","0,00 US$","14,29 %","1,75 %"
Google Campus Bike Tote Navy,"1.697,98 US$",5,154,"11,03 US$","30,80","0,00 US$","23,36 %","0,33 %"
Google Tee White,"1.442,47 US$",74,83,"17,38 US$","1,12","0,00 US$","18,94 %","0,80 %"
Google Canteen Bottle Black,"1.415,41 US$",14,59,"23,99 US$","4,21","0,00 US$","21,25 %","0,73 %"
Google F/C Longsleeve Charcoal,"1.405,86 US$",43,45,"31,24 US$","1,05","0,00 US$","5,57 %","6,85 %"
Google Tee F/C Black,"1.143,53 US$",51,52,"21,99 US$","1,02","0,00 US$","25,80 %","3,79 %"
YouTube Tee Black,"1.011,72 US$",68,87,"11,63 US$","1,28","0,00 US$","18,72 %","1,70 %"
Google Unisex Eco Tee Black,"989,76 US$",42,45,"21,99 US$","1,07","0,00 US$","0,00 %","4.200,00 %"
Google Relaxed Fit Hat Navy,"870,96 US$",8,67,"13,00 US$","8,38","0,00 US$","28,92 %","0,84 %"
Google Flat Front Bag Grey,"839,76 US$",28,28,"29,99 US$","1,00","0,00 US$","9,70 %","0,24 %"
Google Crewneck Sweatshirt Grey,"817,32 US$",17,17,"48,08 US$","1,00","0,00 US$","16,70 %","0,30 %"
YouTube Twill Sandwich Cap Black,"792,65 US$",56,61,"12,99 US$","1,09","0,00 US$","21,13 %","1,13 %"
Google Zip Hoodie Black,"779,85 US$",17,17,"45,87 US$","1,00","0,00 US$","9,90 %","0,12 %"
Google F/C Longsleeve Ash,"764,83 US$",26,26,"29,42 US$","1,00","0,00 US$","8,24 %","7,65 %"
Google Mens Microfleece Jacket Black,"749,98 US$",10,10,"75,00 US$","1,00","0,00 US$","11,21 %","0,18 %"
Google Pullover Hoodie Grey,"737,86 US$",15,17,"43,40 US$","1,13","0,00 US$","20,65 %","0,14 %"
Google Glass Bottle,"735,71 US$",6,32,"22,99 US$","5,33","0,00 US$","16,20 %","0,23 %"
Google Women's Tee F/C Black,"725,77 US$",31,33,"21,99 US$","1,06","0,00 US$","32,21 %","8,05 %"
YouTube Standards Zip Hoodie Black,"719,99 US$",12,12,"60,00 US$","1,00","0,00 US$","3,52 %","1,46 %"
Google Campus Bike,"719,89 US$",17,18,"39,99 US$","1,06","0,00 US$","5,59 %","0,26 %"
Google Tee Blue,"639,90 US$",36,37,"17,29 US$","1,03","0,00 US$","20,22 %","0,88 %"
Google Camp Mug Ivory,"636,68 US$",34,49,"12,99 US$","1,44","0,00 US$","25,02 %","0,77 %"
Google Men's Discovery Lt. Rain Shell,"615,94 US$",7,7,"87,99 US$","1,00","0,00 US$","7,93 %","0,19 %"
Google Bike Tee Navy,"589,31 US$",31,31,"19,01 US$","1,00","0,00 US$","16,22 %","0,74 %"
Google Twill Cap Charcoal,"584,80 US$",29,45,"13,00 US$","1,55","0,00 US$","28,41 %","0,81 %"
Google Sunglasses,"563,50 US$",89,161,"3,50 US$","1,81","0,00 US$","10,91 %","6,60 %"
Google Chrome Dinosaur Collectible,"540,00 US$",17,18,"30,00 US$","1,06","0,00 US$","0,68 %","0,33 %"
Google Tee Red,"532,17 US$",32,32,"16,63 US$","1,00","0,00 US$","23,24 %","0,81 %"
Google Tudes Recycled Tee,"522,87 US$",16,17,"30,76 US$","1,06","0,00 US$","10,91 %","7,27 %"
Google Light Pen Green,"508,30 US$",18,170,"2,99 US$","9,44","0,00 US$","36,54 %","2,55 %"
YouTube Icon Tee Charcoal,"505,96 US$",20,23,"22,00 US$","1,15","0,00 US$","17,32 %","2,23 %"
Google Light Pen Yellow,"496,97 US$",34,166,"2,99 US$","4,88","0,00 US$","23,40 %","2,58 %"
Google Thermal Bottle White,"479,89 US$",19,20,"23,99 US$","1,05","0,00 US$","23,26 %","0,54 %"
Google 24oz Ring Bottle Blue,"454,44 US$",17,65,"6,99 US$","3,82","0,00 US$","33,60 %","0,91 %"
Google Black Tee,"450,81 US$",20,22,"20,49 US$","1,10","0,00 US$","5,26 %","0,99 %"
Google Tonal Tee Coral,"413,50 US$",29,33,"12,53 US$","1,14","0,00 US$","7,62 %","6,70 %"
Google 24 oz Ring Bottle Red,"405,45 US$",12,58,"6,99 US$","4,83","0,00 US$","33,42 %","1,07 %"
Google Campus Bike Eco Tee Navy,"394,89 US$",15,16,"24,68 US$","1,07","0,00 US$","19,55 %","2,26 %"
Google Incognito Flap Pack,"374,95 US$",4,5,"74,99 US$","1,25","0,00 US$","5,23 %","0,06 %"
Google Tee Dark Blue,"374,92 US$",15,15,"24,99 US$","1,00","0,00 US$","20,77 %","3,02 %"
Google Tee Mint Green,"374,91 US$",15,15,"24,99 US$","1,00","0,00 US$","29,43 %","3,59 %"
Google Men's Outpost Vest,"367,93 US$",7,7,"52,56 US$","1,00","0,00 US$","12,30 %","0,63 %"
Google Men's Kirkland Pullover,"365,38 US$",7,7,"52,20 US$","1,00","0,00 US$","8,28 %","0,22 %"
YouTube Pen 2-Pack,"362,22 US$",40,91,"3,98 US$","2,28","0,00 US$","30,16 %","0,99 %"
Google Adventure Bottle Black,"359,94 US$",9,9,"39,99 US$","1,00","0,00 US$","12,18 %","0,23 %"
Google Metallic Notebook Set,"353,52 US$",30,59,"5,99 US$","1,97","0,00 US$","21,42 %","0,92 %"
Android Tone Hoodie Black,"348,00 US$",16,16,"21,75 US$","1,00","0,00 US$","10,28 %","0,24 %"
Google Crew Socks,"335,98 US$",15,21,"16,00 US$","1,40","0,00 US$","29,10 %","0,86 %"
Google Pen Grey,"322,00 US$",22,184,"1,75 US$","8,36","0,00 US$","37,19 %","3,18 %"
Noogler Android Figure 2019,"319,90 US$",19,20,"16,00 US$","1,05","0,00 US$","19,72 %","0,36 %"
Google Men's Tech Fleece Vest Charcoal,"316,00 US$",4,4,"79,00 US$","1,00","0,00 US$","14,84 %","1,41 %"
Google Clear Pen 4-Pack,"314,45 US$",32,63,"4,99 US$","1,97","0,00 US$","45,74 %","2,76 %"
Google Youth FC Tee Charcoal,"299,92 US$",10,12,"24,99 US$","1,20","0,00 US$","25,74 %","0,66 %"
Learning Thermostat 3rd Gen-USA - Stainless Steel,"298,00 US$",1,2,"149,00 US$","2,00","0,00 US$","55,58 %","0,04 %"
Google Tee Green,"294,66 US$",16,16,"18,42 US$","1,00","0,00 US$","15,19 %","0,47 %"
Google Clear Framed Blue Shades,"289,68 US$",9,58,"4,99 US$","6,44","0,00 US$","29,23 %","2,17 %"
YouTube Icon Tee Grey,"285,98 US$",13,13,"22,00 US$","1,00","0,00 US$","17,33 %","1,52 %"
Google Women's Ringer Tee,"274,96 US$",9,11,"25,00 US$","1,22","0,00 US$","20,00 %","45,00 %"
Google Hub Mug White,"272,79 US$",19,21,"12,99 US$","1,11","0,00 US$","18,52 %","0,57 %"
Google Clear Framed Yellow Shades,"269,47 US$",5,54,"4,99 US$","10,80","0,00 US$","25,63 %","1,26 %"
Android Diamond Tee,"267,40 US$",15,15,"17,83 US$","1,00","0,00 US$","13,43 %","1,92 %"
Google Tee Yellow,"266,11 US$",17,19,"14,01 US$","1,12","0,00 US$","21,65 %","0,69 %"
Google Tonal Tee Spearmint,"263,89 US$",17,19,"13,89 US$","1,12","0,00 US$","4,91 %","2,04 %"
Google Magnet,"263,74 US$",23,33,"7,99 US$","1,43","0,00 US$","36,83 %","2,51 %"
Google Crewneck Sweatshirt Navy,"259,97 US$",5,5,"51,99 US$","1,00","0,00 US$","15,13 %","0,11 %"
Google Stylus Pen w/ LED Light,"258,50 US$",15,47,"5,50 US$","3,13","0,00 US$","15,62 %","1,33 %"
Unisex Google Jumbo Print Tee White,"258,10 US$",11,11,"23,46 US$","1,00","0,00 US$","0,00 %","1.100,00 %"
YouTube Crew Socks,"255,94 US$",13,16,"16,00 US$","1,23","0,00 US$","22,84 %","1,08 %"
Google Leather Strap Hat Blue,"249,95 US$",15,15,"16,66 US$","1,00","0,00 US$","31,49 %","1,57 %"
Google Tonal Tee Fog,"246,26 US$",14,16,"15,39 US$","1,14","0,00 US$","9,68 %","11,29 %"
YouTube 25 oz Gear Cap Bottle Black,"242,92 US$",9,9,"26,99 US$","1,00","0,00 US$","16,01 %","0,29 %"
YouTube Wordmark Crew Grey,"239,20 US$",12,12,"19,93 US$","1,00","0,00 US$","9,38 %","0,54 %"
Maze Pen,"236,86 US$",34,238,"1,00 US$","7,00","0,00 US$","31,47 %","2,26 %"
Google Thermal Tumbler Navy,"233,92 US$",13,13,"17,99 US$","1,00","0,00 US$","14,60 %","0,39 %"
Google Laptop and Cell Phone Stickers,"233,49 US$",65,78,"2,99 US$","1,20","0,00 US$","34,62 %","1,30 %"
Unisex Google Pocket Tee Grey,"232,00 US$",8,8,"29,00 US$","1,00","0,00 US$","0,00 %","0,00 %"
Google Tee Grey,"230,87 US$",14,14,"16,49 US$","1,00","0,00 US$","12,08 %","0,16 %"
Google Men's Puff Jacket Black,"230,00 US$",2,2,"115,00 US$","1,00","0,00 US$","6,64 %","0,47 %"
Google Shoreline Tonal Crew Maroon,"225,45 US$",5,5,"45,09 US$","1,00","0,00 US$","20,53 %","0,63 %"
Google Incognito Messenger Bag,"224,98 US$",3,3,"74,99 US$","1,00","0,00 US$","4,59 %","0,08 %"
Google Incognito Zip Pack,"224,98 US$",3,3,"74,99 US$","1,00","0,00 US$","4,11 %","0,03 %"
YouTube Small Sticker Sheet,"224,52 US$",37,75,"2,99 US$","2,03","0,00 US$","32,07 %","1,07 %"
Google Men's Techie Fleece,"219,98 US$",3,3,"73,33 US$","1,00","0,00 US$","8,29 %","0,26 %"
Google Packable Bag Black,"219,90 US$",11,11,"19,99 US$","1,00","0,00 US$","14,29 %","0,19 %"
Google Phone Stand Bamboo,"219,66 US$",25,44,"4,99 US$","1,76","0,00 US$","37,02 %","0,74 %"
Google Shoreline Tonal Crew Olive,"214,45 US$",5,5,"42,89 US$","1,00","0,00 US$","24,51 %","1,21 %"
Google Tri Pen Silver,"211,03 US$",7,17,"12,41 US$","2,43","0,00 US$","16,06 %","1,97 %"
Google Trucker Hat Black,"207,88 US$",14,16,"12,99 US$","1,14","0,00 US$","27,11 %","1,10 %"
Google Large Tote Canvas,"207,84 US$",12,16,"12,99 US$","1,33","0,00 US$","31,81 %","0,96 %"
Google Sherpa Zip Hoodie Charcoal,"207,00 US$",2,3,"69,00 US$","1,50","0,00 US$","4,57 %","0,19 %"
Google Women's White Tee,"202,30 US$",11,11,"18,39 US$","1,00","0,00 US$","30,00 %","6,11 %"
Android Moffet Jacket,"200,00 US$",3,4,"50,00 US$","1,33","0,00 US$","8,68 %","0,32 %"
Google Bike Mini Backpack,"200,00 US$",2,5,"40,00 US$","2,50","0,00 US$","4,02 %","0,11 %"
Google Unisex Pride Eco-Tee Black,"198,00 US$",8,9,"22,00 US$","1,12","0,00 US$","14,91 %","1,53 %"
Mini Android Collectible Figure - Series 7,"194,99 US$",1,1,"194,99 US$","1,00","0,00 US$","3,22 %","0,13 %"
Google Sport Socks,"193,19 US$",8,17,"11,36 US$","2,12","0,00 US$","29,92 %","0,83 %"
Google Pen White,"189,00 US$",40,108,"1,75 US$","2,70","0,00 US$","40,78 %","4,12 %"
Google Women's Grid Zip-Up,"188,97 US$",3,3,"62,99 US$","1,00","0,00 US$","9,67 %","0,16 %"
Google Shoreline Tonal Tee Olive,"184,68 US$",12,12,"15,39 US$","1,00","0,00 US$","35,78 %","5,50 %"
Google Mini Kick Ball,"175,50 US$",15,88,"1,99 US$","5,87","0,00 US$","26,89 %","0,66 %"
Google Toddler FC Zip Hoodie,"174,99 US$",5,5,"35,00 US$","1,00","0,00 US$","12,11 %","0,31 %"
Hello Doorbell - USA,"169,00 US$",1,1,"169,00 US$","1,00","0,00 US$","53,91 %","0,29 %"
YouTube Leather Strap Hat Black,"166,97 US$",10,10,"16,70 US$","1,00","0,00 US$","19,82 %","0,66 %"
Google Twill Cap,"164,85 US$",10,15,"10,99 US$","1,50","0,00 US$","29,14 %","0,59 %"
Google Campus Bike Mini Backpack,"160,00 US$",3,4,"40,00 US$","1,33","0,00 US$","0,72 %","0,43 %"
Google Perk Thermal Tumbler,"159,97 US$",8,8,"20,00 US$","1,00","0,00 US$","12,23 %","0,41 %"
Google Large Standard Journal Grey,"159,95 US$",10,10,"16,00 US$","1,00","0,00 US$","25,29 %","0,98 %"
Google Women's Techie Fleece,"158,39 US$",3,3,"52,80 US$","1,00","0,00 US$","3,08 %","1,15 %"
Campus Corkbase Mug Blue,"152,91 US$",4,9,"16,99 US$","2,25","0,00 US$","25,19 %","0,50 %"
Android Large Removable Sticker Sheet,"152,51 US$",9,51,"2,99 US$","5,67","0,00 US$","32,20 %","0,71 %"
Google Tonal Tee Slate Grey,"151,71 US$",9,9,"16,86 US$","1,00","0,00 US$","18,18 %","81,82 %"
Google Infant Charcoal Onesie,"149,97 US$",6,6,"25,00 US$","1,00","0,00 US$","39,82 %","0,29 %"
Google Unisex Ringer Tee,"149,94 US$",6,6,"24,99 US$","1,00","0,00 US$","0,00 %","0,00 %"
Google Fold-over Beanie Grey,"149,92 US$",14,15,"9,99 US$","1,07","0,00 US$","28,78 %","0,50 %"
Google Utility Bag Grey,"149,88 US$",11,15,"9,99 US$","1,36","0,00 US$","14,96 %","0,32 %"
YouTube Play Mug,"147,96 US$",10,12,"12,33 US$","1,20","0,00 US$","20,73 %","0,56 %"
Android Trace Bottle Black,"143,94 US$",1,6,"23,99 US$","6,00","0,00 US$","15,95 %","0,20 %"
Google Crew Socks Summer 18,"143,91 US$",9,9,"15,99 US$","1,00","0,00 US$","36,48 %","0,99 %"
Google Mesh Bag Blue,"143,85 US$",13,24,"5,99 US$","1,85","0,00 US$","26,53 %","0,50 %"
Google Separating Keyring,"139,85 US$",16,20,"6,99 US$","1,25","0,00 US$","23,99 %","1,58 %"
Android Ugly Sweater,"135,00 US$",3,3,"45,00 US$","1,00","0,00 US$","13,88 %","0,95 %"
Google Clear Framed Gray Shades,"135,00 US$",3,27,"5,00 US$","9,00","0,00 US$","19,47 %","1,33 %"
Google Heathered Pom Beanie,"135,00 US$",6,9,"15,00 US$","1,50","0,00 US$","23,52 %","0,57 %"
YouTube Kids Tee White,"127,95 US$",17,18,"7,11 US$","1,06","0,00 US$","0,00 %","0,00 %"
Android Sport Socks,"125,99 US$",7,9,"14,00 US$","1,29","0,00 US$","13,65 %","0,34 %"
Android Iconic Backpack,"125,00 US$",1,5,"25,00 US$","5,00","0,00 US$","4,21 %","0,14 %"
Google Summer19 Crew Grey,"123,99 US$",2,2,"62,00 US$","1,00","0,00 US$","11,72 %","1,56 %"
Android Techie 3D Framed Art,"123,98 US$",5,5,"24,80 US$","1,00","0,00 US$","9,02 %","0,55 %"
Windup Android,"123,69 US$",8,31,"3,99 US$","3,88","0,00 US$","26,21 %","0,55 %"
Google Raincoat Navy,"120,00 US$",1,1,"120,00 US$","1,00","0,00 US$","2,76 %","0,39 %"
Google Red Speckled Tee,"120,00 US$",4,4,"30,00 US$","1,00","0,00 US$","10,23 %","4,55 %"
Google Woodtop Bottle Black,"120,00 US$",4,4,"30,00 US$","1,00","0,00 US$","14,36 %","0,14 %"
Google Laptop Sleeve Charcoal,"119,96 US$",6,6,"19,99 US$","1,00","0,00 US$","8,94 %","0,28 %"
Google Thermal Bottle Red,"119,95 US$",3,5,"23,99 US$","1,67","0,00 US$","28,34 %","0,70 %"
Android Small Removable Sticker Sheet,"119,60 US$",10,40,"2,99 US$","4,00","0,00 US$","38,59 %","1,01 %"
Cam Outdoor Security Camera - USA,"119,00 US$",1,1,"119,00 US$","1,00","0,00 US$","39,24 %","0,03 %"
Google Crew Combed Cotton Sock,"118,98 US$",7,7,"17,00 US$","1,00","0,00 US$","32,20 %","0,80 %"
Google Large Tote White,"116,96 US$",8,9,"13,00 US$","1,12","0,00 US$","23,68 %","0,57 %"
Google Mouse Pad Navy,"114,85 US$",16,23,"4,99 US$","1,44","0,00 US$","28,94 %","0,70 %"
YouTube Women's Favorite Tee White,"112,16 US$",7,8,"14,02 US$","1,14","0,00 US$","23,91 %","2,17 %"
Google Striped Accessory Pouch,"110,93 US$",6,8,"13,87 US$","1,33","0,00 US$","26,03 %","0,54 %"
Android 25 oz Gear Cap Bottle White,"110,65 US$",5,5,"22,13 US$","1,00","0,00 US$","14,31 %","0,86 %"
Google Women's Pride Eco-Tee Black,"110,00 US$",5,5,"22,00 US$","1,00","0,00 US$","24,39 %","12,20 %"
Google Shoreline Tonal Tee Maroon,"107,73 US$",6,7,"15,39 US$","1,17","0,00 US$","30,04 %","2,58 %"
Unisex Google Striped Tee White,"107,30 US$",4,4,"26,82 US$","1,00","0,00 US$","0,00 %","0,00 %"
Android SM S/F18 Sticker Sheet,"104,65 US$",4,35,"2,99 US$","8,75","0,00 US$","45,01 %","0,81 %"
Google Dad Hat Navy,"103,92 US$",6,8,"12,99 US$","1,33","0,00 US$","32,36 %","0,88 %"
Google Speckled Beanie Navy,"100,00 US$",5,5,"20,00 US$","1,00","0,00 US$","23,03 %","0,67 %"
Youth Jumbo Print Tee White,"100,00 US$",4,4,"25,00 US$","1,00","0,00 US$","0,00 %","0,00 %"
Google Toddler FC Tee Charcoal,"99,98 US$",4,4,"25,00 US$","1,00","0,00 US$","29,31 %","0,40 %"
7in Dog Frisbee,"99,00 US$",10,66,"1,50 US$","6,60","0,00 US$","33,83 %","3,76 %"
Google Men's Softshell Moss,"99,00 US$",1,1,"99,00 US$","1,00","0,00 US$","9,83 %","0,34 %"
Google Sport Socks Summer 18,"97,93 US$",4,7,"13,99 US$","1,75","0,00 US$","35,16 %","0,76 %"
Android Mountains Tee,"97,45 US$",5,5,"19,49 US$","1,00","0,00 US$","5,68 %","1,09 %"
Google Women's Tee Grey,"96,78 US$",5,5,"19,36 US$","1,00","0,00 US$","10,13 %","0,96 %"
YouTube Transmission Journal Red,"96,00 US$",6,6,"16,00 US$","1,00","0,00 US$","16,18 %","0,38 %"
Google Bike Tee Grey,"95,96 US$",4,4,"23,99 US$","1,00","0,00 US$","21,69 %","0,41 %"
Google See-No Hear-No Set,"95,96 US$",6,8,"12,00 US$","1,33","0,00 US$","4,48 %","0,06 %"
YouTube Transmission Journal Black,"95,94 US$",6,6,"15,99 US$","1,00","0,00 US$","10,02 %","0,22 %"
Google Mesh Bag Red,"95,86 US$",10,16,"5,99 US$","1,60","0,00 US$","35,29 %","1,30 %"
Google Mountain View Tee Blue,"92,48 US$",4,4,"23,12 US$","1,00","0,00 US$","15,05 %","0,82 %"
Android Women's Peace Tee Black,"92,40 US$",10,10,"9,24 US$","1,00","0,00 US$","23,58 %","3,14 %"
Google Youth FC Zip Hoodie,"90,00 US$",2,2,"45,00 US$","1,00","0,00 US$","12,32 %","0,22 %"
YouTube Icon Pullover Black,"89,98 US$",2,2,"44,99 US$","1,00","0,00 US$","9,31 %","0,21 %"
Google Women's Tech Fleece Grey,"89,00 US$",1,1,"89,00 US$","1,00","0,00 US$","14,04 %","1,75 %"
Google Women's Discovery Lt. Rain Shell,"87,99 US$",1,1,"87,99 US$","1,00","0,00 US$","11,29 %","0,16 %"
I am Not a Robot Tee White,"87,99 US$",8,8,"11,00 US$","1,00","0,00 US$","9,21 %","0,23 %"
Google Light Pen Red,"86,71 US$",7,29,"2,99 US$","4,14","0,00 US$","33,62 %","1,53 %"
Google Pen Navy,"85,75 US$",24,49,"1,75 US$","2,04","0,00 US$","39,00 %","3,52 %"
Google Leather Strap Hat Red,"82,98 US$",4,5,"16,60 US$","1,25","0,00 US$","28,22 %","0,76 %"
Google Keychain,"80,00 US$",8,10,"8,00 US$","1,25","0,00 US$","2,45 %","4,91 %"
Google Dino Game Tee,"79,98 US$",2,2,"39,99 US$","1,00","0,00 US$","13,68 %","0,42 %"
Google Sherpa Vest Black,"79,00 US$",1,1,"79,00 US$","1,00","0,00 US$","1,60 %","0,53 %"
Google Tri Pen Black,"78,33 US$",5,7,"11,19 US$","1,40","0,00 US$","18,81 %","1,11 %"
Google Small Cable Organizer Blue,"77,74 US$",7,26,"2,99 US$","3,71","0,00 US$","18,33 %","0,86 %"
Android Dino Buddies Tee Green,"74,97 US$",3,3,"24,99 US$","1,00","0,00 US$","23,53 %","8,82 %"
Android Dino Buddies Tee Grey,"74,97 US$",3,3,"24,99 US$","1,00","0,00 US$","8,60 %","3,23 %"
Mind Blown Tee White,"74,78 US$",6,6,"12,46 US$","1,00","0,00 US$","8,07 %","0,45 %"
Android Sport Socks Summer 18,"69,95 US$",4,5,"13,99 US$","1,25","0,00 US$","14,74 %","0,48 %"
Google Bot,"69,95 US$",7,7,"9,99 US$","1,00","0,00 US$","21,71 %","0,78 %"
Android Super Hero 3D Framed Art,"68,00 US$",3,3,"22,67 US$","1,00","0,00 US$","10,48 %","0,57 %"
Google Crew Striped Athletic Sock,"67,98 US$",3,4,"17,00 US$","1,33","0,00 US$","25,17 %","0,41 %"
Google Women's Eco Tee Black,"65,97 US$",3,3,"21,99 US$","1,00","0,00 US$","37,70 %","4,92 %"
Google Dad Hat Maroon,"64,94 US$",6,6,"10,82 US$","1,00","0,00 US$","26,46 %","2,06 %"
Google Women's Outpost Vest,"63,99 US$",2,2,"32,00 US$","1,00","0,00 US$","12,83 %","0,20 %"
YouTube Crew Socks Summer 18,"63,96 US$",3,4,"15,99 US$","1,33","0,00 US$","22,50 %","0,34 %"
Google Confetti Pen White,"61,25 US$",16,35,"1,75 US$","2,19","0,00 US$","37,72 %","2,03 %"
Google Cup Cap Tumbler Grey,"60,00 US$",1,2,"30,00 US$","2,00","0,00 US$","10,24 %","0,12 %"
Google Heather Green Speckled Tee,"60,00 US$",2,2,"30,00 US$","1,00","0,00 US$","15,87 %","1,59 %"
Google Youth FC Longsleeve Charcoal,"60,00 US$",2,2,"30,00 US$","1,00","0,00 US$","13,65 %","0,32 %"
Google Premium Sunglasses,"59,99 US$",3,3,"20,00 US$","1,00","0,00 US$","10,63 %","0,22 %"
Google Snapback Black Cap,"59,97 US$",3,3,"19,99 US$","1,00","0,00 US$","12,07 %","0,20 %"
Robert Test,"58,40 US$",2,2,"29,20 US$","1,00","0,00 US$","0,00 %","0,00 %"
Android Pocket Tee Navy,"58,00 US$",2,2,"29,00 US$","1,00","0,00 US$","14,04 %","1,12 %"
Flamingo and Friends Tee Blue,"58,00 US$",2,2,"29,00 US$","1,00","0,00 US$","1,77 %","1,77 %"
Google Austin Campus Zip Hoodie,"58,00 US$",1,1,"58,00 US$","1,00","0,00 US$","0,00 %","6,25 %"
Google Campus Bike Carry Pouch,"57,99 US$",5,7,"8,28 US$","1,40","0,00 US$","28,41 %","0,64 %"
Google Cork Base Tumbler,"56,00 US$",2,2,"28,00 US$","1,00","0,00 US$","8,21 %","0,10 %"
Google Wallet Stand Black,"55,91 US$",8,14,"3,99 US$","1,75","0,00 US$","11,61 %","0,25 %"
Unisex Google Color Block Tee White,"55,10 US$",3,3,"18,37 US$","1,00","0,00 US$","12,70 %","4,76 %"
Google Crewneck Sweatshirt Green,"55,00 US$",1,1,"55,00 US$","1,00","0,00 US$","16,57 %","0,19 %"
Google Pride Tote Black,"55,00 US$",4,5,"11,00 US$","1,25","0,00 US$","16,99 %","0,32 %"
Android Twill Cap Black,"54,54 US$",5,6,"9,09 US$","1,20","0,00 US$","24,51 %","1,23 %"
YouTube Kids Onesie White,"52,00 US$",6,6,"8,67 US$","1,00","0,00 US$","31,07 %","0,39 %"
Android Mug Gray,"51,96 US$",3,4,"12,99 US$","1,33","0,00 US$","26,34 %","0,28 %"
Google Recycled Notebook Set Natural,"51,96 US$",3,4,"12,99 US$","1,33","0,00 US$","10,68 %","0,33 %"
Google Beanie Olive,"51,27 US$",3,3,"17,09 US$","1,00","0,00 US$","24,22 %","0,72 %"
Google Large Standard Journal Navy,"49,59 US$",4,4,"12,40 US$","1,00","0,00 US$","19,86 %","0,27 %"
Google Small Standard Journal Navy,"48,07 US$",4,4,"12,02 US$","1,00","0,00 US$","22,20 %","0,33 %"
Google Lapel Pin,"48,00 US$",3,6,"8,00 US$","2,00","0,00 US$","13,13 %","1,52 %"
Google Toddler Tee White,"48,00 US$",2,2,"24,00 US$","1,00","0,00 US$","20,93 %","0,16 %"
YouTube Transmission Bottle Black,"47,99 US$",2,2,"24,00 US$","1,00","0,00 US$","10,62 %","0,05 %"
Android Puzzlebot v2,"47,98 US$",3,3,"15,99 US$","1,00","0,00 US$","11,53 %","0,34 %"
Android Crew Socks Summer 18,"47,97 US$",3,3,"15,99 US$","1,00","0,00 US$","25,16 %","0,62 %"
Google Leather Strap Hat Black,"47,97 US$",3,3,"15,99 US$","1,00","0,00 US$","23,05 %","0,30 %"
Google Soft Modal Scarf,"45,00 US$",1,1,"45,00 US$","1,00","0,00 US$","11,06 %","0,05 %"
Stan and Friends Tee Green,"45,00 US$",2,2,"22,50 US$","1,00","0,00 US$","15,15 %","3,03 %"
Google Red YoYo,"44,00 US$",2,11,"4,00 US$","5,50","0,00 US$","36,36 %","3,03 %"
Google Women's Black Tee,"43,98 US$",2,2,"21,99 US$","1,00","0,00 US$","3,11 %","1,04 %"
Android Youth Explorer Tee,"42,49 US$",3,3,"14,16 US$","1,00","0,00 US$","10,97 %","0,42 %"
YouTube Icon Bundle,"42,00 US$",1,1,"42,00 US$","1,00","0,00 US$","17,73 %","0,71 %"
Google Color Block Tote White,"40,99 US$",3,3,"13,66 US$","1,00","0,00 US$","36,44 %","0,31 %"
Google Twill Sandwich Cap Navy,"40,26 US$",4,4,"10,06 US$","1,00","0,00 US$","38,89 %","1,59 %"
Google Pen Grass Green,"40,25 US$",16,23,"1,75 US$","1,44","0,00 US$","55,72 %","4,82 %"
Google Inverted Umbrella,"40,00 US$",1,1,"40,00 US$","1,00","0,00 US$","2,63 %","0,20 %"
Google Tudes Thermal Bottle,"39,99 US$",1,1,"39,99 US$","1,00","0,00 US$","9,13 %","0,06 %"
Android Buoy Bottle,"39,97 US$",4,5,"7,99 US$","1,25","0,00 US$","13,02 %","0,30 %"
Android Notebook Set Black,"39,92 US$",4,8,"4,99 US$","2,00","0,00 US$","17,30 %","0,67 %"
Google KeepCup,"35,00 US$",1,1,"35,00 US$","1,00","0,00 US$","6,46 %","0,09 %"
Android Hexagon Tee,"34,98 US$",2,2,"17,49 US$","1,00","0,00 US$","8,33 %","0,76 %"
Android Leather Strap Hat Black,"34,00 US$",2,2,"17,00 US$","1,00","0,00 US$","17,62 %","0,21 %"
Google Campus Bike Corkbase Mug Blue,"34,00 US$",2,2,"17,00 US$","1,00","0,00 US$","8,15 %","0,56 %"
Google Pen Bright Blue,"33,25 US$",16,19,"1,75 US$","1,19","0,00 US$","47,41 %","3,31 %"
Android Iconic Hat Green,"32,00 US$",2,2,"16,00 US$","1,00","0,00 US$","20,00 %","0,53 %"
YouTube Buoy Bottle,"31,96 US$",2,4,"7,99 US$","2,00","0,00 US$","20,05 %","0,27 %"
Google Pen Lilac,"31,50 US$",13,18,"1,75 US$","1,38","0,00 US$","44,91 %","2,88 %"
Youth Google Pocket Tee Blue,"31,20 US$",2,2,"15,60 US$","1,00","0,00 US$","0,00 %","66,67 %"
YouTube Flex Journal Black,"30,35 US$",4,5,"6,07 US$","1,25","0,00 US$","15,53 %","0,39 %"
Google LoveHandle Black,"30,00 US$",3,3,"10,00 US$","1,00","0,00 US$","5,19 %","0,37 %"
Google Navy Speckled Tee,"30,00 US$",1,1,"30,00 US$","1,00","0,00 US$","18,63 %","0,38 %"
Google Unisex 3/4 Raglan Red,"29,99 US$",1,1,"29,99 US$","1,00","0,00 US$","37,50 %","4,17 %"
Google Pen Neon Coral,"29,75 US$",15,17,"1,75 US$","1,13","0,00 US$","53,37 %","4,60 %"
Android Garden Tee Orange,"29,00 US$",1,1,"29,00 US$","1,00","0,00 US$","5,77 %","0,96 %"
Google Beanie Maroon,"28,48 US$",2,2,"14,24 US$","1,00","0,00 US$","20,10 %","0,50 %"
Android Fanatic Bundle,"28,00 US$",1,1,"28,00 US$","1,00","0,00 US$","11,22 %","0,20 %"
Android Iconic Pen,"28,00 US$",4,16,"1,75 US$","4,00","0,00 US$","20,80 %","1,22 %"
Google Maps Pin,"28,00 US$",2,4,"7,00 US$","2,00","0,00 US$","15,59 %","0,68 %"
Google Cloth & Pouch Black,"27,96 US$",6,7,"3,99 US$","1,17","0,00 US$","12,15 %","0,36 %"
Google Campus Bike Bottle,"27,00 US$",1,1,"27,00 US$","1,00","0,00 US$","6,39 %","0,20 %"
Google Pen Red,"26,25 US$",14,15,"1,75 US$","1,07","0,00 US$","46,30 %","5,19 %"
Google 16 oz Tumbler Blue,"25,98 US$",2,2,"12,99 US$","1,00","0,00 US$","22,73 %","0,16 %"
Google Campus Corkbase Mug Purple,"25,49 US$",3,3,"8,50 US$","1,00","0,00 US$","34,20 %","0,98 %"
Google NYC Campus Unisex Tee,"25,00 US$",1,1,"25,00 US$","1,00","0,00 US$","0,00 %","0,97 %"
Google Red Kids Sunglasses,"24,95 US$",3,5,"4,99 US$","1,67","0,00 US$","29,74 %","0,33 %"
Android Iconic Bottle Black,"24,00 US$",1,1,"24,00 US$","1,00","0,00 US$","17,06 %","0,29 %"
Google Youth Badge Tee Navy,"24,00 US$",1,1,"24,00 US$","1,00","0,00 US$","0,00 %","1,56 %"
Google Youth Hero Tee Grey,"24,00 US$",1,1,"24,00 US$","1,00","0,00 US$","18,05 %","0,49 %"
